{"schema_version":"1.0","knowledge_id":"knowledge-equipment-engineer-001","tenant_id":"tenant-hctm","world_run_id":"world-run-genesis-001","branch_id":"main","actor_ref":{"namespace":"hctm","type":"position","code":"EQUIPMENT-ENGINEER-SZ"},"fact_ref":{"namespace":"hctm","type":"world_event","code":"world-event-vibration-rise-01"},"observed_at":"2026-07-08T10:16:00+08:00","valid_at":"2026-07-08T10:15:00+08:00","source_ref":"sensor:VIB-LAS-WLD-02-01","confidence":"0.95","visibility_scope":"assigned_recipients"}
